{
  "schema_version": 1,
  "product_id": "B1",
  "as_of_date": "2026-09-28",
  "sections": {
    "purposes": {
      "status": "assessed",
      "items": [{"purpose_id": "synthetic-purpose", "description": "Synthetic demonstration purpose only", "evidence_ref": "synthetic-evidence"}]
    },
    "data_categories": {
      "status": "assessed",
      "items": [{"category_id": "synthetic-category", "category": "Synthetic placeholder category; not an observed data type", "classification": "ordinary", "source": "Synthetic fixture generator", "evidence_ref": "synthetic-evidence"}]
    },
    "lawful_basis": {
      "decision": "proposed", "basis_description": "Synthetic proposal label; not a legal basis determination", "rationale": "Synthetic example only", "evidence_ref": "synthetic-evidence", "counsel_required": true
    },
    "consent": {
      "decision": "required", "rationale": "Synthetic proposed choice only; counsel must determine", "evidence_ref": "synthetic-evidence", "counsel_required": true
    },
    "processing_operations": {
      "status": "assessed",
      "items": [{"operation_id": "synthetic-operation", "product_id": "B1", "system_ref": "synthetic-system", "purpose_ref": "synthetic-purpose", "data_category_refs": ["synthetic-category"], "evidence_ref": "synthetic-evidence"}]
    },
    "processors": {
      "status": "assessed", "no_processors_declared": false,
      "items": [{"processor_id": "synthetic-processor", "product_id": "B1", "role": "processor", "service_description": "Synthetic processor placeholder, not an actual vendor", "data_received": ["Synthetic category only"], "terms_status": "identified", "evidence_ref": "synthetic-evidence"}]
    },
    "residency_transfers": {
      "status": "assessed", "known_locations": ["synthetic location; not an observed hosting location"], "no_transfers_declared": true, "transfers": []
    },
    "retention": {
      "status": "assessed",
      "items": [{"category_ref": "synthetic-category", "trigger": "Synthetic trigger", "period_description": "Synthetic proposed duration; no retention instruction", "disposition": "Synthetic disposition", "decision_status": "proposed", "evidence_ref": "synthetic-evidence"}]
    },
    "access_roles": {
      "status": "assessed",
      "items": [{"role_id": "synthetic-role", "access_description": "Synthetic role only", "purpose": "Synthetic purpose only", "evidence_ref": "synthetic-evidence"}]
    },
    "deletion_procedure": {
      "status": "assessed", "owner_role": "synthetic-owner", "request_route": "Synthetic route; no operational endpoint asserted",
      "steps": [{"step_id": "synthetic-delete-step", "system_ref": "synthetic-system", "action": "Synthetic deletion action description", "verification": "Synthetic verification method", "evidence_ref": "synthetic-evidence"}],
      "exceptions": ["Synthetic exception placeholder; founder/counsel must replace"]
    },
    "deletion_test": {
      "test_id": "synthetic-delete-test", "product_id": "B1", "procedure_ref": "synthetic-delete-step", "executed_on": "2026-09-20", "valid_until": "2026-12-31", "freshness_policy_ref": "synthetic-owner-policy", "freshness_policy_approved": true,
      "test_subject_ref": "synthetic-subject", "expected_result": "Synthetic records absent after test deletion", "observed_result": "Synthetic records absent after test deletion", "result": "pass", "evidence_ref": "synthetic-evidence"
    },
    "pia": {
      "status": "prepared", "reviewer_role": "Synthetic reviewer role; not an actual reviewer", "evidence_ref": "synthetic-evidence",
      "risks": [{"risk_id": "synthetic-risk", "scenario": "Synthetic risk scenario", "likelihood": "low", "impact": "low", "mitigation": "Synthetic mitigation", "residual_risk": "Synthetic residual risk", "evidence_ref": "synthetic-evidence"}]
    }
  },
  "counsel_review": {
    "status": "pending",
    "required_topics": ["Synthetic placeholder: identify appropriate counsel review topics"]
  }
}
